{
  "protocol_id": "CORR-001",
  "name": "Corrosion Testing - Salt Spray and Humidity",
  "category": "degradation",
  "version": "1.0.0",
  "description": "Comprehensive corrosion testing protocol for photovoltaic modules and components using accelerated salt spray and humidity exposure. Tests resistance to corrosive environments including marine, coastal, and industrial atmospheres.",
  "standards": [
    {
      "name": "IEC",
      "number": "61701",
      "title": "Salt Mist Corrosion Testing of Photovoltaic Modules",
      "year": 2020
    },
    {
      "name": "ASTM",
      "number": "B117",
      "title": "Standard Practice for Operating Salt Spray (Fog) Apparatus",
      "year": 2019
    },
    {
      "name": "IEC",
      "number": "61215",
      "title": "Terrestrial Photovoltaic Modules - Design Qualification and Type Approval",
      "year": 2021
    }
  ],
  "parameters": {
    "test_conditions": {
      "salt_spray": {
        "solution_concentration": "5% NaCl",
        "temperature": "35°C ± 2°C",
        "ph_range": "6.5 - 7.2",
        "fall_rate": "1.0 - 2.0 ml/80cm²/h"
      },
      "humidity_chamber": {
        "temperature": "85°C ± 2°C",
        "relative_humidity": "85% ± 5%"
      }
    },
    "equipment": [
      {
        "name": "Salt Spray Chamber",
        "type": "environmental_chamber",
        "model": "ASTM B117 Compliant",
        "calibration_required": true
      },
      {
        "name": "Humidity Chamber",
        "type": "environmental_chamber",
        "model": "IEC 61215 Compliant",
        "calibration_required": true
      },
      {
        "name": "Digital Thermometer",
        "type": "temperature_sensor",
        "calibration_required": true
      },
      {
        "name": "Hygrometer",
        "type": "humidity_sensor",
        "calibration_required": true
      },
      {
        "name": "pH Meter",
        "type": "chemical_sensor",
        "calibration_required": true
      },
      {
        "name": "IV Curve Tracer",
        "type": "electrical_tester",
        "calibration_required": true
      },
      {
        "name": "Visual Inspection Microscope",
        "type": "optical",
        "calibration_required": false
      }
    ],
    "sample_requirements": {
      "quantity": 3,
      "dimensions": "Minimum 1000mm x 1000mm for full modules, or representative coupons",
      "preparation": "Clean samples with IPA, dry completely, document baseline condition"
    }
  },
  "steps": [
    {
      "step_number": 1,
      "name": "Initial Documentation and Inspection",
      "type": "preparation",
      "description": "Photograph all samples, record serial numbers, perform visual inspection for existing defects, measure and document baseline dimensions.",
      "duration": {
        "value": 30,
        "unit": "minutes"
      },
      "automated": false,
      "quality_checks": [
        "All samples photographed from multiple angles",
        "Serial numbers clearly visible and recorded",
        "No pre-existing damage that would invalidate test"
      ]
    },
    {
      "step_number": 2,
      "name": "Baseline Electrical Characterization",
      "type": "measurement",
      "description": "Measure IV curves at STC conditions (1000 W/m², 25°C, AM1.5G). Record Voc, Isc, Pmax, FF, Rs, Rsh. Perform electroluminescence imaging if available.",
      "duration": {
        "value": 45,
        "unit": "minutes"
      },
      "automated": true,
      "quality_checks": [
        "IV curves show expected behavior",
        "All electrical parameters within datasheet specifications",
        "EL images show uniform emission (if applicable)"
      ]
    },
    {
      "step_number": 3,
      "name": "Prepare Salt Spray Solution",
      "type": "preparation",
      "description": "Mix 5% ± 1% NaCl solution using distilled water. Verify pH is between 6.5-7.2. Filter solution to remove impurities. Preheat to 35°C.",
      "duration": {
        "value": 20,
        "unit": "minutes"
      },
      "automated": false,
      "quality_checks": [
        "Solution concentration verified with hydrometer or mass measurement",
        "pH within specified range",
        "Solution clear with no visible contaminants"
      ]
    },
    {
      "step_number": 4,
      "name": "Salt Spray Exposure - Cycle 1",
      "type": "conditioning",
      "description": "Place samples in salt spray chamber at 35°C. Ensure samples are angled 15-30° from vertical. Expose to continuous salt fog for 48 hours. Monitor temperature and solution delivery rate.",
      "duration": {
        "value": 48,
        "unit": "hours"
      },
      "automated": true,
      "quality_checks": [
        "Chamber temperature maintained at 35°C ± 2°C",
        "Salt fog uniformly distributed",
        "Solution fall rate within specification"
      ]
    },
    {
      "step_number": 5,
      "name": "Post-Spray Recovery and Drying",
      "type": "preparation",
      "description": "Remove samples from chamber. Gently rinse with distilled water to remove salt deposits. Allow samples to air dry at ambient conditions for 24 hours.",
      "duration": {
        "value": 24,
        "unit": "hours"
      },
      "automated": false,
      "quality_checks": [
        "All salt residue removed",
        "Samples completely dry before next step",
        "No handling damage during transfer"
      ]
    },
    {
      "step_number": 6,
      "name": "Humidity Exposure - Cycle 1",
      "type": "conditioning",
      "description": "Place samples in humidity chamber at 85°C and 85% RH. Expose for 96 hours. Monitor temperature and humidity continuously. Log any deviations.",
      "duration": {
        "value": 96,
        "unit": "hours"
      },
      "automated": true,
      "quality_checks": [
        "Temperature maintained at 85°C ± 2°C",
        "Relative humidity at 85% ± 5%",
        "No condensation on samples"
      ]
    },
    {
      "step_number": 7,
      "name": "Post-Humidity Recovery",
      "type": "preparation",
      "description": "Allow samples to cool and equilibrate to ambient conditions. Minimum 4 hours at 23°C ± 5°C and 50% ± 10% RH.",
      "duration": {
        "value": 4,
        "unit": "hours"
      },
      "automated": false,
      "quality_checks": [
        "Samples at room temperature",
        "No moisture condensation visible",
        "Ready for inspection and testing"
      ]
    },
    {
      "step_number": 8,
      "name": "Interim Visual Inspection",
      "type": "measurement",
      "description": "Perform detailed visual inspection. Document any corrosion, discoloration, delamination, bubbles, or other defects. Compare to baseline photos. Measure defect dimensions.",
      "duration": {
        "value": 30,
        "unit": "minutes"
      },
      "automated": false,
      "quality_checks": [
        "All visible changes documented with photos",
        "Defects measured and recorded",
        "Comparison to baseline completed"
      ]
    },
    {
      "step_number": 9,
      "name": "Interim Electrical Testing",
      "type": "measurement",
      "description": "Measure IV curves and key electrical parameters. Compare to baseline. Calculate degradation percentages. Perform insulation resistance test (wet leakage current).",
      "duration": {
        "value": 45,
        "unit": "minutes"
      },
      "automated": true,
      "quality_checks": [
        "IV measurements completed at STC",
        "Insulation resistance > 40 MΩ·m²",
        "Data logged and compared to baseline"
      ]
    },
    {
      "step_number": 10,
      "name": "Repeat Exposure Cycles",
      "type": "conditioning",
      "description": "Repeat steps 4-9 for a total of 3 complete cycles. Each cycle consists of: 48h salt spray, 24h recovery, 96h humidity, 4h recovery, inspection, and testing.",
      "duration": {
        "value": 512,
        "unit": "hours"
      },
      "automated": true,
      "quality_checks": [
        "All cycles completed as specified",
        "Continuous monitoring data logged",
        "No premature test termination due to equipment failure"
      ]
    },
    {
      "step_number": 11,
      "name": "Final Visual Inspection and Documentation",
      "type": "measurement",
      "description": "Comprehensive final visual inspection. High-resolution photography from all angles. Document all corrosion sites, edge seal condition, junction box integrity, and overall appearance.",
      "duration": {
        "value": 45,
        "unit": "minutes"
      },
      "automated": false,
      "quality_checks": [
        "Complete photographic documentation",
        "All defects cataloged and measured",
        "Inspection report generated"
      ]
    },
    {
      "step_number": 12,
      "name": "Final Electrical Characterization",
      "type": "measurement",
      "description": "Complete electrical testing suite: IV curves, EL imaging, insulation resistance, ground continuity, wet leakage current. Calculate all degradation metrics relative to baseline.",
      "duration": {
        "value": 60,
        "unit": "minutes"
      },
      "automated": true,
      "quality_checks": [
        "All electrical parameters measured",
        "Degradation calculations completed",
        "Pass/fail determination made"
      ]
    },
    {
      "step_number": 13,
      "name": "Data Analysis and Report Generation",
      "type": "analysis",
      "description": "Analyze all collected data. Generate degradation curves, correlation plots, statistical summaries. Prepare comprehensive test report with photos, data tables, and charts.",
      "duration": {
        "value": 120,
        "unit": "minutes"
      },
      "automated": true,
      "quality_checks": [
        "All data analyzed",
        "Statistical analysis completed",
        "Report generated and reviewed"
      ]
    }
  ],
  "data_fields": [
    {
      "field_id": "sample_id",
      "name": "Sample ID",